{
  "$schema": "https://json-schema.org/draft/2020-12/schema",
  "title": "QimiaoDaily game versions",
  "type": "array",
  "items": {
    "type": "object",
    "required": ["id", "game", "versionNumber", "versionName", "startAt", "endAt", "notes", "enabled"],
    "properties": {
      "id": { "type": "string", "minLength": 1 },
      "game": { "type": "string", "minLength": 1 },
      "versionNumber": { "type": "string", "minLength": 1 },
      "versionName": { "type": "string" },
      "startAt": { "type": "string", "format": "date-time" },
      "endAt": { "type": "string", "format": "date-time" },
      "notes": { "type": "string" },
      "enabled": { "type": "boolean" }
    }
  }
}
